{
  "id": "py-parsons-003",
  "type": "parsons",
  "track": "python",
  "difficulty": 2,
  "skillNodes": ["python.loops", "python.lists"],
  "payload": {
    "language": "python",
    "indent": true,
    "maxIndent": 2,
    "blocks": [
      { "id": "b1", "code": "def double_all(nums):" },
      { "id": "b2", "code": "result = []" },
      { "id": "b3", "code": "for n in nums:" },
      { "id": "b4", "code": "result.append(n * 2)" },
      { "id": "b5", "code": "return result" }
    ]
  },
  "answer": {
    "solution": [
      { "id": "b1", "indent": 0 },
      { "id": "b2", "indent": 1 },
      { "id": "b3", "indent": 1 },
      { "id": "b4", "indent": 2 },
      { "id": "b5", "indent": 1 }
    ]
  },
  "explanation": "Create the result list before the loop, append each doubled value inside it, and return after the loop."
}
