{
  "id": "py-parsons-002",
  "type": "parsons",
  "track": "python",
  "difficulty": 2,
  "skillNodes": ["python.loops", "python.functions"],
  "payload": {
    "language": "python",
    "indent": true,
    "maxIndent": 2,
    "blocks": [
      { "id": "b1", "code": "def factorial(n):" },
      { "id": "b2", "code": "result = 1" },
      { "id": "b3", "code": "for i in range(2, n + 1):" },
      { "id": "b4", "code": "result *= i" },
      { "id": "b5", "code": "return result" }
    ]
  },
  "answer": {
    "solution": [
      { "id": "b1", "indent": 0 },
      { "id": "b2", "indent": 1 },
      { "id": "b3", "indent": 1 },
      { "id": "b4", "indent": 2 },
      { "id": "b5", "indent": 1 }
    ]
  },
  "explanation": "Initialise the accumulator to 1, multiply through 2..n inside the loop, then return."
}
