{
  "id": "js-parsons-002",
  "type": "parsons",
  "track": "javascript",
  "difficulty": 2,
  "skillNodes": ["javascript.loops", "javascript.functions"],
  "payload": {
    "language": "javascript",
    "indent": true,
    "maxIndent": 2,
    "blocks": [
      { "id": "b1", "code": "function factorial(n) {" },
      { "id": "b2", "code": "let result = 1;" },
      { "id": "b3", "code": "for (let i = 2; i <= n; i++) {" },
      { "id": "b4", "code": "result *= i;" },
      { "id": "b5", "code": "}" },
      { "id": "b6", "code": "return result;" },
      { "id": "b7", "code": "}" }
    ]
  },
  "answer": {
    "solution": [
      { "id": "b1", "indent": 0 },
      { "id": "b2", "indent": 1 },
      { "id": "b3", "indent": 1 },
      { "id": "b4", "indent": 2 },
      { "id": "b5", "indent": 1 },
      { "id": "b6", "indent": 1 },
      { "id": "b7", "indent": 0 }
    ]
  },
  "explanation": "Multiply the accumulator from 2 through n inside the loop, then return after closing it."
}
