{
  "id": "js-parsons-001",
  "type": "parsons",
  "track": "javascript",
  "difficulty": 2,
  "skillNodes": ["javascript.loops", "javascript.conditionals"],
  "payload": {
    "language": "javascript",
    "indent": true,
    "maxIndent": 2,
    "blocks": [
      { "id": "b1", "code": "function sumEvens(nums) {" },
      { "id": "b2", "code": "let total = 0;" },
      { "id": "b3", "code": "for (const n of nums) {" },
      { "id": "b4", "code": "if (n % 2 === 0) total += n;" },
      { "id": "b5", "code": "}" },
      { "id": "b6", "code": "return total;" },
      { "id": "b7", "code": "}" }
    ]
  },
  "answer": {
    "solution": [
      { "id": "b1", "indent": 0 },
      { "id": "b2", "indent": 1 },
      { "id": "b3", "indent": 1 },
      { "id": "b4", "indent": 2 },
      { "id": "b5", "indent": 1 },
      { "id": "b6", "indent": 1 },
      { "id": "b7", "indent": 0 }
    ]
  },
  "explanation": "Close the `for` loop before returning; the `return` and closing brace sit at function level."
}
