{
  "id": "js-bigo-001",
  "type": "big-o",
  "track": "javascript",
  "difficulty": 1,
  "skillNodes": ["algorithms.arrays", "complexity.time"],
  "payload": {
    "language": "javascript",
    "prompt": "time",
    "code": "function sum(arr) {\n  let total = 0;\n  for (const x of arr) {\n    total += x;\n  }\n  return total;\n}",
    "options": ["O(1)", "O(log n)", "O(n)", "O(n log n)", "O(n^2)"]
  },
  "answer": { "correct": "O(n)" },
  "explanation": "A single pass over the array does constant work per element: O(n)."
}
